URL,Version,Status,OIDs,Name,Title,Description,Uses,Used,Sources
http://hl7.org/fhir/ValueSet/additional-instruction-codes,4.0.1,draft,"2.16.840.1.113883.4.642.3.95",SNOMEDCTAdditionalDosageInstructions,SNOMED CT Additional Dosage Instructions,"This value set includes all SNOMED CT Additional Dosage Instructions.","StructureDefinition/au-dosage","SCT"
http://hl7.org/fhir/ValueSet/administration-method-codes,4.0.1,draft,"2.16.840.1.113883.4.642.3.97",SNOMEDCTAdministrationMethodCodes,SNOMED CT Administration Method Codes,"This value set includes some method codes from SNOMED CT - provided as an exemplar","StructureDefinition/au-dosage","SCT"
http://hl7.org/fhir/ValueSet/bodystructure-code,4.0.1,draft,"2.16.840.1.113883.4.642.3.142",SNOMEDCTMorphologicAbnormalities,SNOMED CT Morphologic Abnormalities,"This value set includes all codes from [SNOMED CT](http://snomed.info/sct) where concept is-a 442083009 (Anatomical or acquired body site (body structure)).","StructureDefinition/au-bodystructure","SCT"
http://hl7.org/fhir/ValueSet/diagnostic-service-sections,4.0.1,draft,"2.16.840.1.113883.4.642.3.234",DiagnosticServiceSectionCodes,Diagnostic Service Section Codes,"This value set includes all the codes in HL7 V2 table 0074.","StructureDefinition/au-diagnosticreport,StructureDefinition/au-diagnosticresult","THO (V2)"
http://terminology.hl7.org.au/ValueSet/accession-number-type,6.0.1-ci-build,active,"2.16.840.1.113883.2.3.4.2.4.23",AccessionNumberType,Accession Number Type,"Identifier types that may be associated with an accession number in an Australian context.","StructureDefinition/au-accessionnumber","THO (V2)"
http://terminology.hl7.org.au/ValueSet/amt-mp-codes,6.0.1-ci-build,retired,"2.16.840.1.113883.2.3.4.2.4.16",AMTMedicinalProductAndSubstances,AMT Medicinal Product and Substances,"The AMT Medicinal Product and Substances value set includes values that may be used to identify a substance or a medicinal product that is an ingredient of a medication. ",,"SCT"
http://terminology.hl7.org.au/ValueSet/au-coverage-type-extended,6.0.1-ci-build,active,"2.16.840.1.113883.2.3.4.2.4.40",CoverageTypeandSelfPayCodesAUExtended,Coverage Type and Self-Pay Codes - AU Extended,"Coverage type codes extended for use in an Australian context. Includes HL7 international codes plus Australian additions to create a complete set.","StructureDefinition/au-coverage","Internal,THO"
http://terminology.hl7.org.au/ValueSet/au-timezone,6.0.1-ci-build,active,"2.16.840.1.113883.2.3.4.2.4.27",AUTimeZone,AU Time Zone,"Australian time zones.","StructureDefinition/au-timezone,StructureDefinition/au-timezone-usage","Other"
http://terminology.hl7.org.au/ValueSet/contact-purpose,6.0.1-ci-build,active,"2.16.840.1.113883.2.3.4.2.4.19",ContactPurpose,Contact Purpose,"The purpose for which an associated contact can be reached.","StructureDefinition/contact-purpose,StructureDefinition/au-organization","Internal"
http://terminology.hl7.org.au/ValueSet/dva-entitlement,6.0.1-ci-build,active,"2.16.840.1.113883.2.3.4.2.4.22",DVAEntitlement,DVA Entitlement,"Entitlement types that may be associated with an individual's Department of Veterans’ Affairs (DVA) File Number on a DVA issued health card in an Australian context.","StructureDefinition/au-dvanumber","Internal"
http://terminology.hl7.org.au/ValueSet/jurisdiction-extended,6.0.1-ci-build,active,"2.16.840.1.113883.2.3.4.2.4.33",JurisdictionValueSetAUExtended,Jurisdiction ValueSet - AU Extended,"Jurisdiction ValueSet extended for use in an Australian context. Includes HL7 international codes plus Australian additions to create a complete set.",,"Other"
http://terminology.hl7.org.au/ValueSet/location-physical-type-extended,6.0.1-ci-build,active,"2.16.840.1.113883.2.3.4.2.4.25",LocationPhysicalTypeAUExtended,Location Type (Physical) - AU Extended,"Location type (physical) extended for use in an Australian context. Includes HL7 international codes plus Australian additions to create a complete set.","StructureDefinition/au-location","Internal"
http://terminology.hl7.org.au/ValueSet/medication-type,6.0.1-ci-build,active,"2.16.840.1.113883.2.3.4.2.4.1",MedicationType,Medication Type,"The Medication Type value set may be used to classify the nature of properties defined by the code e.g. branded product with no strength or form. This allows the distinction between codes provided containing container, pack, strength and form explicitly especially where terminologies supplied are unknown or terminology services are unavailable.","StructureDefinition/medication-type","Internal"
http://terminology.hl7.org.au/ValueSet/medicine-item-change,6.0.1-ci-build,active,"2.16.840.1.113883.2.3.4.2.4.6",MedicineItemChange,Medicine Item Change,"The Medicine Item Change value set includes values that may be used to identify that a change that has been made, or is recommended to be made, to a medicine item.","StructureDefinition/au-medlist","Internal"
http://terminology.hl7.org.au/ValueSet/mims,6.0.1-ci-build,active,"2.16.840.1.113883.2.3.4.2.4.7",MIMS,MIMS,"The MIMS value set includes all values from the Monthly Index of Medical Specialties (MIMS) published by MIMS Australia. Further details can be found at https://www.mims.com.au/.","StructureDefinition/au-medicationstatement,StructureDefinition/au-medicationrequest,StructureDefinition/au-medicationdispense,StructureDefinition/au-medicationadministration,StructureDefinition/au-medication","Internal"
http://terminology.hl7.org.au/ValueSet/name-context,6.0.1-ci-build,active,"2.16.840.1.113883.2.3.4.2.4.34",NameContext,Name Context,"The Name Context value set may be used to classify suitable uses or purposes of names.","StructureDefinition/name-context","Internal"
http://terminology.hl7.org.au/ValueSet/order-identifier-type,6.0.1-ci-build,active,"2.16.840.1.113883.2.3.4.2.4.24",OrderIdentifierType,Order Identifier Type,"Identifier types that may be associated with an order identifier in an Australian context.","StructureDefinition/au-localorderidentifier","THO (V2)"
http://terminology.hl7.org.au/ValueSet/pbs-item,6.0.1-ci-build,active,"2.16.840.1.113883.2.3.4.2.4.8",PBSItemCodes,PBS Item Codes,"The PBS Item Codes value set includes all values from Australian Pharmaceutical Benefits Scheme (PBS) schedule published by the Department of Health. Further details can be found at https://www.pbs.gov.au/pbs/.","StructureDefinition/au-medicationstatement,StructureDefinition/au-medicationrequest,StructureDefinition/au-medicationdispense,StructureDefinition/au-medicationadministration,StructureDefinition/au-medication","Internal"
http://terminology.hl7.org.au/ValueSet/rsg-source,6.0.1-ci-build,active,"2.16.840.1.113883.2.3.4.2.4.42",AURecordedSexOrGenderSource,AU Recorded Sex or Gender (RSG) Source,"The AU Recorded Sex or Gender (RSG) Source value set includes codes that can be used to represent the non-document source where the sex or gender value is recorded.",,"Internal"
http://terminology.hl7.org.au/ValueSet/rsg-source-document-type,6.0.1-ci-build,active,"2.16.840.1.113883.2.3.4.2.4.32",AURecordedSexOrGenderSourceDocumentType,AU Recorded Sex or Gender (RSG) Source Document Type,"The AU Recorded Sex or Gender (RSG) Source Document Type value set includes codes that can be used to represent the type of document where this sex or gender value is recorded.",,"Internal,LOINC"
http://terminology.hl7.org.au/ValueSet/rsg-type,6.0.1-ci-build,active,"2.16.840.1.113883.2.3.4.2.4.31",AURecordedSexOrGenderType,AU Recorded Sex or Gender Type,"The AU Recorded Sex or Gender Type value set includes codes that can be used to represent the type or category of sex or gender that is recorded.",,"SCT,Internal,LOINC"
http://terminology.hl7.org.au/ValueSet/service-provision-conditions,6.0.1-ci-build,active,"2.16.840.1.113883.2.3.4.2.4.2",ServiceProvisionConditionsAustralianConcepts,Service Provision Conditions Australian Concepts,"The Service Provision Conditions Australian Concepts value set includes values that may be used to identify the type of service provision conditions in an Australian context.","StructureDefinition/au-healthcareservice","Internal"
http://terminology.hl7.org.au/ValueSet/v2-0203-extended,6.0.1-ci-build,active,"2.16.840.1.113883.2.3.4.2.3.203",Hl7VSIdentifierTypeAUExtended,hl7VS-identifierType - AU Extended,"Extended value set of identifier types for use in an Australian context. Includes HL7 international codes plus Australian additions to create a complete set. NOTE: codes contained LACN Laboratory Accession ID and ACN Accession ID are exclusive concepts and not consider related in this terminology.",,"THO (V2),Internal"
http://terminology.hl7.org.au/ValueSet/v2-0360-extended,6.0.1-ci-build,active,"2.16.840.1.113883.2.3.4.2.3.360",Hl7VSDegreeLicenseCertificateAUExtended,hl7VS-degreeLicenseCertificate - AU Extended,"hl7VS-degreeLicenseCertificate extended for use in an Australian context. Includes HL7 international codes plus Australian additions to create a complete set.","StructureDefinition/au-practitioner","Internal"
http://terminology.hl7.org.au/ValueSet/v2-0443-extended,6.0.1-ci-build,active,"2.16.840.1.113883.2.3.4.2.3.443",Hl7VSProviderRoleAUExtended,hl7VS-providerRole - AU Extended,"hl7VS-providerRole extended for use in an Australian context. Includes HL7 international codes plus Australian additions to create a complete set.","StructureDefinition/au-immunization","THO (V2),Internal"
http://terminology.hl7.org.au/ValueSet/v3-ActEncounterCode-extended,6.0.1-ci-build,active,"2.16.840.1.113883.2.3.4.2.4.20",ActEncounterCodeAUExtended,ActEncounterCode - AU Extended,"v3 Act Encounter Code extended for use in an Australian context. Includes HL7 international codes plus Australian additions to create a complete set.","StructureDefinition/au-encounter","Internal"
http://terminology.hl7.org.au/ValueSet/v3-ServiceDeliveryLocationRoleType-extended,6.0.1-ci-build,active,"2.16.840.1.113883.2.3.4.2.4.26",ServiceDeliveryLocationRoleTypeAUExtended,ServiceDeliveryLocationRoleType - AU Extended,"ServiceDeliveryLocationRoleType extended for use in an Australian context. Includes HL7 international codes plus Australian additions to create a complete set.","StructureDefinition/au-location","Internal"
http://terminology.hl7.org/ValueSet/contactentity-type,2.0.0,active,"2.16.840.1.113883.4.642.3.416",ContactEntityType,Contact entity type,"This example value set defines a set of codes that can be used to indicate the purpose for which you would contact a contact party.","ValueSet/contact-purpose","THO"
http://terminology.hl7.org/ValueSet/jurisdiction,1.0.0,active,"2.16.840.1.113883.11.21029",JurisdictionValueSet,Jurisdiction ValueSet,"This value set defines a base set of codes for country, country subdivision and region    for indicating where a resource is intended to be used.             Note: The codes for countries and country subdivisions are taken from    [ISO 3166](https://www.iso.org/iso-3166-country-codes.html)    while the codes for ""supra-national"" regions are from    [UN Standard country or area codes for statistical use (M49)](http://unstats.un.org/unsd/methods/m49/m49.htm).","ValueSet/au-jurisdiction-extended","Other"
http://terminology.hl7.org/ValueSet/location-physical-type,1.0.1,active,"2.16.840.1.113883.4.642.3.328",LocationType,Location type,"This example value set defines a set of codes that can be used to indicate the physical form of the Location.","ValueSet/au-location-physical-type-extended","THO"
http://terminology.hl7.org/ValueSet/v2-0360,3.0.0,active,"2.16.840.1.113883.21.236",Hl7VSDegreeLicenseCertificate,hl7VS-degreeLicenseCertificate,"Concepts specifying an educational degree (e.g., MD).  Used in the CNN datatype (names and identifiers of clinicians) in Version 2 messaging.  Used in Version 2 messaging; note that in releases of HL7 prior to 2.3.1, was also used in person names (XPN), but this use was deprecated, then withdrawn in 2.7.","ValueSet/au-v2-0360-extended","THO (V2)"
http://terminology.hl7.org/ValueSet/v3-ActCoverageTypeCode,3.0.0,active,"2.16.840.1.113883.1.11.19855",ActCoverageTypeCode,ActCoverageTypeCode,"**Definition:** Set of codes indicating the type of insurance policy or program that pays for the cost of benefits provided to covered parties.","ValueSet/au-coverage-type-extended","THO (V3)"
http://terminology.hl7.org/ValueSet/v3-ActEncounterCode,3.0.0,active,"2.16.840.1.113883.1.11.13955",ActEncounterCode,ActEncounterCode,"Domain provides codes that qualify the ActEncounterClass (ENC)","ValueSet/au-v3-ActEncounterCode-extended","THO (V3)"
http://terminology.hl7.org/ValueSet/v3-GTIN,3.0.0,active,"2.16.840.1.113883.1.11.19885",GTIN,GTIN,"**Description:**Global Trade Item Number is an identifier for trade items developed by GS1 (comprising the former EAN International and Uniform Code Council).","StructureDefinition/au-medicationstatement,StructureDefinition/au-medicationrequest,StructureDefinition/au-medicationdispense,StructureDefinition/au-medicationadministration,StructureDefinition/au-medication","THO (V3)"
http://terminology.hl7.org/ValueSet/v3-ServiceDeliveryLocationRoleType,3.0.0,active,"2.16.840.1.113883.1.11.17660",ServiceDeliveryLocationRoleType,ServiceDeliveryLocationRoleType,"A role of a place that further classifies the setting (e.g., accident site, road side, work site, community location) in which services are delivered.","ValueSet/au-v3-ServiceDeliveryLocationRoleType-extended","THO (V3)"
https://healthterminologies.gov.au/fhir/ValueSet/adverse-reaction-agent-1,1.1.1,active,"1.2.36.1.2001.1004.201.10036",AdverseReactionAgent,Adverse Reaction Agent,"The Adverse Reaction Agent value set includes values that support the recording of agents that may be responsible for causing adverse reactions. It is a broad set encompassing medicinal and non-medicinal agents.","StructureDefinition/au-allergyintolerance","SCT"
https://healthterminologies.gov.au/fhir/ValueSet/adverse-reaction-clinical-manifestation-1,1.0.0,active,"1.2.36.1.2001.1004.201.10296",AdverseReactionClinicalManifestation,Adverse Reaction Clinical Manifestation,"The Adverse Reaction Clinical Manifestation value set supports the recording of clinical manifestations of adverse reactions (including allergies and intolerances).","StructureDefinition/au-allergyintolerance","SCT"
https://healthterminologies.gov.au/fhir/ValueSet/amt-vaccine-1,1.0.2,active,"1.2.36.1.2001.1004.201.10042",AustralianMedicinesTerminologyVaccine,Australian Medicines Terminology Vaccine,"The Australian Medicines Terminology (AMT) Vaccine value set includes AMT product concepts that may be used to record a vaccine product.","StructureDefinition/au-immunization","SCT"
https://healthterminologies.gov.au/fhir/ValueSet/assertion-of-absence-1,1.0.1,active,"1.2.36.1.2001.1004.201.10065",AssertionOfAbsence,Assertion Of Absence,"The Assertion Of Absence value set includes values to represent clinical statements that broadly assert a procedure has not been done or the absence of a finding.","StructureDefinition/au-norelevantfinding","SCT"
https://healthterminologies.gov.au/fhir/ValueSet/australian-immunisation-register-vaccine-1,1.0.2,active,"1.2.36.1.2001.1004.201.10043",AustralianImmunisationRegisterVaccine,Australian Immunisation Register Vaccine,"The Australian Immunisation Register Vaccine value set includes values that may be used to represent a vaccine product according to the Australian Immunisation Register vaccine code formats.","StructureDefinition/au-immunization","Other"
https://healthterminologies.gov.au/fhir/ValueSet/australian-indigenous-status-1,1.0.2,active,"1.2.36.1.2001.1004.201.10001",AustralianIndigenousStatus,Australian Indigenous Status,"The Australian Indigenous Status value set includes values to support the representation of a person's Indigenous status. That is, whether a person identifies as being of Aboriginal or Torres Strait Islander origin. The values are those concepts defined in the Australian Indigenous Status code system (https://healthterminologies.gov.au/fhir/CodeSystem/australian-indigenous-status-1).","StructureDefinition/indigenous-status","Other"
https://healthterminologies.gov.au/fhir/ValueSet/australian-medication-1,1.0.2,active,"1.2.36.1.2001.1004.201.10003",AustralianMedication,Australian Medication,"The Australian Medication value set includes all Australian Medicines Terminology (AMT) product concepts that may be used for the identification of a medicine, vaccine or other therapeutic good. This is suitable for the recording of a product which may be ordered for, administered to, or used by an individual.","StructureDefinition/au-medicationstatement,StructureDefinition/au-medicationrequest,StructureDefinition/au-medicationdispense,StructureDefinition/au-medicationadministration,StructureDefinition/au-medication","SCT"
https://healthterminologies.gov.au/fhir/ValueSet/australian-medication-use-1,1.0.0,active,"1.2.36.1.2001.1004.201.10303",AustralianMedicationUse,Australian Medication Use,"The Australian Medication Use value set extends the NCTS Australian Medication value set by including all Australian Medicines Terminology (AMT) product concepts that may be used for the identification of a medicine, vaccine or other therapeutic good, together with the concept 787481004 |No known medications| (SNOMED CT). This value set is suitable for recording the medication or asserting the absence of known medications in a Medication Statement.","StructureDefinition/au-medicationstatement","SCT"
https://healthterminologies.gov.au/fhir/ValueSet/australian-states-territories-2,2.0.2,active,"1.2.36.1.2001.1004.201.10026",AustralianStatesAndTerritories,Australian States and Territories,"The Australian States and Territories value set includes values that represent the Australian states and territories.","StructureDefinition/au-address","Other"
https://healthterminologies.gov.au/fhir/ValueSet/australian-veteran-status-1,1.0.0,active,"1.2.36.1.2001.1004.201.10282",AustralianVeteranStatus,Australian Veteran Status,"The Australian Veteran Status value set includes values to support the representation of a person's veteran status in the Australian Defence Force. The values are those concepts defined in the Australian Veteran Status code system (https://healthterminologies.gov.au/fhir/CodeSystem/australian-veteran-status-1).","StructureDefinition/veteran-status","Other"
https://healthterminologies.gov.au/fhir/ValueSet/body-site-1,1.0.2,active,"1.2.36.1.2001.1004.201.10031",BodySite,Body Site,"The Body Site value set includes values that cover a broad range of anatomical and acquired body structures suitable for identifying a body site.","StructureDefinition/au-condition,StructureDefinition/au-bodystructure,StructureDefinition/au-servicerequest,StructureDefinition/au-dosage,StructureDefinition/au-diagnosticrequest,StructureDefinition/au-imagingresult,StructureDefinition/au-specimen,StructureDefinition/au-procedure,StructureDefinition/au-medicationadministration","SCT"
https://healthterminologies.gov.au/fhir/ValueSet/body-site-relative-site-qualifier-1,1.0.0,active,"1.2.36.1.2001.1004.201.10238",BodySiteRelativeSiteQualifier,Body Site Relative Site Qualifier,"The Body Site Relative Site Qualifier value set includes values that may be used to represent a relative body site when qualifying an anatomical location.","StructureDefinition/au-bodystructure","SCT"
https://healthterminologies.gov.au/fhir/ValueSet/clinical-condition-1,1.0.2,active,"1.2.36.1.2001.1004.201.10035",ClinicalCondition,Clinical Condition,"The Clinical Condition value set includes values that cover a broad range of clinical concepts to support the representation of conditions, including problems, diagnoses and disorders.","StructureDefinition/au-condition","SCT"
https://healthterminologies.gov.au/fhir/ValueSet/clinical-finding-1,1.0.2,active,"1.2.36.1.2001.1004.201.10037",ClinicalFinding,Clinical Finding,"The Clinical Finding value set includes a broad range of values that support the recording of disorders and clinical findings, including observations, judgments or assessments about subjects of care.","StructureDefinition/au-condition,StructureDefinition/au-dosage,StructureDefinition/au-imagingreport,StructureDefinition/au-diagnosticreport,StructureDefinition/au-pathologyreport","SCT"
https://healthterminologies.gov.au/fhir/ValueSet/clinical-specialty-1,1.1.0,active,"1.2.36.1.2001.1004.201.10186",ClinicalSpecialty,Clinical Specialty,"The Clinical Specialty value set includes values that may be used to describe a clinical specialty performed by an entity.","StructureDefinition/au-healthcareservice,StructureDefinition/au-practitionerrole","SCT"
https://healthterminologies.gov.au/fhir/ValueSet/common-languages-australia-2,2.2.1,active,"1.2.36.1.2001.1004.201.10069",CommonLanguagesInAustralia,Common Languages in Australia,"The Common Languages in Australia value set includes languages that are commonly encountered in Australia, including a comprehensive set of Australian Indigenous languages.","StructureDefinition/au-healthcareservice,StructureDefinition/au-relatedperson,StructureDefinition/au-practitioner,StructureDefinition/au-patient","hl7.fhir.uv.xver-r5.r4"
https://healthterminologies.gov.au/fhir/ValueSet/concurrent-supply-grounds-1,1.0.0,active,"1.2.36.1.2001.1004.201.10245",ConcurrentSupplyGrounds,Concurrent Supply Grounds,"The Concurrent Supply Grounds value set includes values that may be used for the grounds that authorise a subsidy for the concurrent supply of an item specified in a prescription and all of its repeats.","StructureDefinition/subsidised-concurrent-supply","Other"
https://healthterminologies.gov.au/fhir/ValueSet/contact-relationship-type-3,3.1.0,active,"1.2.36.1.2001.1004.201.10187",ContactRelationshipType,Contact Relationship Type,"The Contact Relationship Type value set includes values that may be used to describe the nature of the relationship between the subject and the contact person.","StructureDefinition/au-patient","SCT"
https://healthterminologies.gov.au/fhir/ValueSet/date-accuracy-indicator-1,1.0.2,active,"1.2.36.1.2001.1004.201.10004",DateAccuracyIndicator,Date Accuracy Indicator,"The Date Accuracy Indicator value set includes values that indicate the accuracy of components of a reported date.","StructureDefinition/date-accuracy-indicator","Other"
https://healthterminologies.gov.au/fhir/ValueSet/encounter-type-1,1.0.1,active,"1.2.36.1.2001.1004.201.10086",EncounterType,Encounter Type,"The Encounter Type value set includes values that can be used to represent types of healthcare interactions.","StructureDefinition/au-encounter","SCT"
https://healthterminologies.gov.au/fhir/ValueSet/evaluation-procedure-1,1.0.0,active,"1.2.36.1.2001.1004.201.10182",EvaluationProcedure,Evaluation Procedure,"The Evaluation Procedure value set includes values that cover a broad range of procedures including specialist investigations, imaging procedures, pathology procedures, and other diagnostic investigations.","StructureDefinition/au-diagnosticreport,StructureDefinition/au-diagnosticrequest,StructureDefinition/au-diagnosticresult","SCT"
https://healthterminologies.gov.au/fhir/ValueSet/healthcare-organisation-role-type-1,1.1.0,active,"1.2.36.1.2001.1004.201.10112",HealthcareOrganisationRoleType,Healthcare Organisation Role Type,"The Healthcare Organisation Role Type value set includes values that can represent the role, use or function of a healthcare related organisation or facility.","StructureDefinition/au-organization","SCT"
https://healthterminologies.gov.au/fhir/ValueSet/ihi-record-status-1,1.0.2,active,"1.2.36.1.2001.1004.201.10022",IndividualHealthcareIdentifierRecordStatus,Individual Healthcare Identifier Record Status,"The Individual Healthcare Identifier Record Status value set includes values that may be used to describe the classification status of a record of an Individual Healthcare Identifier.","StructureDefinition/ihi-record-status","Other"
https://healthterminologies.gov.au/fhir/ValueSet/ihi-status-1,1.0.2,active,"1.2.36.1.2001.1004.201.10021",IndividualHealthcareIdentifierStatus,Individual Healthcare Identifier Status,"The Individual Healthcare Identifier Status value set includes values that may be used to describe the classification status of an Individual Healthcare Identifier.","StructureDefinition/ihi-status","Other"
https://healthterminologies.gov.au/fhir/ValueSet/imaging-anatomic-region-of-interest-1,1.0.0,active,"1.2.36.1.2001.1004.201.10239",ImagingAnatomicRegionOfInterest,Imaging Anatomic Region Of Interest,"The Imaging Anatomic Region of Interest value set includes values that may be used to represent the anatomic area of interest of a diagnostic imaging procedure.","StructureDefinition/au-imagingresult","SCT"
https://healthterminologies.gov.au/fhir/ValueSet/imaging-procedure-1,1.0.2,active,"1.2.36.1.2001.1004.201.10034",ImagingProcedure,Imaging Procedure,"The Imaging Procedure value set includes values that support the representation of medical imaging procedures.","StructureDefinition/au-imagingreport,StructureDefinition/au-imagingresult","SCT"
https://healthterminologies.gov.au/fhir/ValueSet/immunisation-anatomical-site-1,1.0.2,active,"1.2.36.1.2001.1004.201.10045",ImmunisationAnatomicalSite,Immunisation Anatomical Site,"The Immunisation Anatomical Site value set includes values that can be used to describe the anatomical site where an immunisation may be administered.","StructureDefinition/au-immunization","SCT"
https://healthterminologies.gov.au/fhir/ValueSet/immunisation-route-of-administration-1,1.0.2,active,"1.2.36.1.2001.1004.201.10050",ImmunisationRouteOfAdministration,Immunisation Route of Administration,"The Immunisation Route of Administration value set includes values that can be used to describe the route by which a vaccine is administered.","StructureDefinition/au-immunization","SCT"
