URL,Version,Status,OIDs,Name,Title,Description,Uses,Used,Sources
http://terminology.hl7.org.au/ValueSet/accession-number-type,6.0.1-ci-build,active,"2.16.840.1.113883.2.3.4.2.4.23",AccessionNumberType,Accession Number Type,"Identifier types that may be associated with an accession number in an Australian context.",,"THO (V2)"
http://terminology.hl7.org.au/ValueSet/amt-mp-codes,6.0.1-ci-build,retired,"2.16.840.1.113883.2.3.4.2.4.16",AMTMedicinalProductAndSubstances,AMT Medicinal Product and Substances,"The AMT Medicinal Product and Substances value set includes values that may be used to identify a substance or a medicinal product that is an ingredient of a medication. ",,"SCT"
http://terminology.hl7.org.au/ValueSet/au-coverage-type-extended,6.0.1-ci-build,active,"2.16.840.1.113883.2.3.4.2.4.40",CoverageTypeandSelfPayCodesAUExtended,Coverage Type and Self-Pay Codes - AU Extended,"Coverage type codes extended for use in an Australian context. Includes HL7 international codes plus Australian additions to create a complete set.",,"Internal,THO"
http://terminology.hl7.org.au/ValueSet/au-timezone,6.0.1-ci-build,active,"2.16.840.1.113883.2.3.4.2.4.27",AUTimeZone,AU Time Zone,"Australian time zones.",,"Other"
http://terminology.hl7.org.au/ValueSet/contact-purpose,6.0.1-ci-build,active,"2.16.840.1.113883.2.3.4.2.4.19",ContactPurpose,Contact Purpose,"The purpose for which an associated contact can be reached.",,"Internal"
http://terminology.hl7.org.au/ValueSet/dva-entitlement,6.0.1-ci-build,active,"2.16.840.1.113883.2.3.4.2.4.22",DVAEntitlement,DVA Entitlement,"Entitlement types that may be associated with an individual's Department of Veterans’ Affairs (DVA) File Number on a DVA issued health card in an Australian context.",,"Internal"
http://terminology.hl7.org.au/ValueSet/jurisdiction-extended,6.0.1-ci-build,active,"2.16.840.1.113883.2.3.4.2.4.33",JurisdictionValueSetAUExtended,Jurisdiction ValueSet - AU Extended,"Jurisdiction ValueSet extended for use in an Australian context. Includes HL7 international codes plus Australian additions to create a complete set.",,"Other"
http://terminology.hl7.org.au/ValueSet/location-physical-type-extended,6.0.1-ci-build,active,"2.16.840.1.113883.2.3.4.2.4.25",LocationPhysicalTypeAUExtended,Location Type (Physical) - AU Extended,"Location type (physical) extended for use in an Australian context. Includes HL7 international codes plus Australian additions to create a complete set.",,"Internal"
http://terminology.hl7.org.au/ValueSet/medication-type,6.0.1-ci-build,active,"2.16.840.1.113883.2.3.4.2.4.1",MedicationType,Medication Type,"The Medication Type value set may be used to classify the nature of properties defined by the code e.g. branded product with no strength or form. This allows the distinction between codes provided containing container, pack, strength and form explicitly especially where terminologies supplied are unknown or terminology services are unavailable.",,"Internal"
http://terminology.hl7.org.au/ValueSet/medicine-item-change,6.0.1-ci-build,active,"2.16.840.1.113883.2.3.4.2.4.6",MedicineItemChange,Medicine Item Change,"The Medicine Item Change value set includes values that may be used to identify that a change that has been made, or is recommended to be made, to a medicine item.",,"Internal"
http://terminology.hl7.org.au/ValueSet/mims,6.0.1-ci-build,active,"2.16.840.1.113883.2.3.4.2.4.7",MIMS,MIMS,"The MIMS value set includes all values from the Monthly Index of Medical Specialties (MIMS) published by MIMS Australia. Further details can be found at https://www.mims.com.au/.",,"Internal"
http://terminology.hl7.org.au/ValueSet/name-context,6.0.1-ci-build,active,"2.16.840.1.113883.2.3.4.2.4.34",NameContext,Name Context,"The Name Context value set may be used to classify suitable uses or purposes of names.",,"Internal"
http://terminology.hl7.org.au/ValueSet/order-identifier-type,6.0.1-ci-build,active,"2.16.840.1.113883.2.3.4.2.4.24",OrderIdentifierType,Order Identifier Type,"Identifier types that may be associated with an order identifier in an Australian context.",,"THO (V2)"
http://terminology.hl7.org.au/ValueSet/pbs-item,6.0.1-ci-build,active,"2.16.840.1.113883.2.3.4.2.4.8",PBSItemCodes,PBS Item Codes,"The PBS Item Codes value set includes all values from Australian Pharmaceutical Benefits Scheme (PBS) schedule published by the Department of Health. Further details can be found at https://www.pbs.gov.au/pbs/.",,"Internal"
http://terminology.hl7.org.au/ValueSet/rsg-source,6.0.1-ci-build,active,"2.16.840.1.113883.2.3.4.2.4.42",AURecordedSexOrGenderSource,AU Recorded Sex or Gender (RSG) Source,"The AU Recorded Sex or Gender (RSG) Source value set includes codes that can be used to represent the non-document source where the sex or gender value is recorded.",,"Internal"
http://terminology.hl7.org.au/ValueSet/rsg-source-document-type,6.0.1-ci-build,active,"2.16.840.1.113883.2.3.4.2.4.32",AURecordedSexOrGenderSourceDocumentType,AU Recorded Sex or Gender (RSG) Source Document Type,"The AU Recorded Sex or Gender (RSG) Source Document Type value set includes codes that can be used to represent the type of document where this sex or gender value is recorded.",,"Internal,LOINC"
http://terminology.hl7.org.au/ValueSet/rsg-type,6.0.1-ci-build,active,"2.16.840.1.113883.2.3.4.2.4.31",AURecordedSexOrGenderType,AU Recorded Sex or Gender Type,"The AU Recorded Sex or Gender Type value set includes codes that can be used to represent the type or category of sex or gender that is recorded.",,"SCT,Internal,LOINC"
http://terminology.hl7.org.au/ValueSet/service-provision-conditions,6.0.1-ci-build,active,"2.16.840.1.113883.2.3.4.2.4.2",ServiceProvisionConditionsAustralianConcepts,Service Provision Conditions Australian Concepts,"The Service Provision Conditions Australian Concepts value set includes values that may be used to identify the type of service provision conditions in an Australian context.",,"Internal"
http://terminology.hl7.org.au/ValueSet/v2-0203-extended,6.0.1-ci-build,active,"2.16.840.1.113883.2.3.4.2.3.203",Hl7VSIdentifierTypeAUExtended,hl7VS-identifierType - AU Extended,"Extended value set of identifier types for use in an Australian context. Includes HL7 international codes plus Australian additions to create a complete set. NOTE: codes contained LACN Laboratory Accession ID and ACN Accession ID are exclusive concepts and not consider related in this terminology.",,"THO (V2),Internal"
http://terminology.hl7.org.au/ValueSet/v2-0360-extended,6.0.1-ci-build,active,"2.16.840.1.113883.2.3.4.2.3.360",Hl7VSDegreeLicenseCertificateAUExtended,hl7VS-degreeLicenseCertificate - AU Extended,"hl7VS-degreeLicenseCertificate extended for use in an Australian context. Includes HL7 international codes plus Australian additions to create a complete set.",,"Internal"
http://terminology.hl7.org.au/ValueSet/v2-0443-extended,6.0.1-ci-build,active,"2.16.840.1.113883.2.3.4.2.3.443",Hl7VSProviderRoleAUExtended,hl7VS-providerRole - AU Extended,"hl7VS-providerRole extended for use in an Australian context. Includes HL7 international codes plus Australian additions to create a complete set.",,"THO (V2),Internal"
http://terminology.hl7.org.au/ValueSet/v3-ActEncounterCode-extended,6.0.1-ci-build,active,"2.16.840.1.113883.2.3.4.2.4.20",ActEncounterCodeAUExtended,ActEncounterCode - AU Extended,"v3 Act Encounter Code extended for use in an Australian context. Includes HL7 international codes plus Australian additions to create a complete set.",,"Internal"
http://terminology.hl7.org.au/ValueSet/v3-ServiceDeliveryLocationRoleType-extended,6.0.1-ci-build,active,"2.16.840.1.113883.2.3.4.2.4.26",ServiceDeliveryLocationRoleTypeAUExtended,ServiceDeliveryLocationRoleType - AU Extended,"ServiceDeliveryLocationRoleType extended for use in an Australian context. Includes HL7 international codes plus Australian additions to create a complete set.",,"Internal"
